{
  "$schema": "https://json-schema.org/draft/2020-12/schema",
  "$id": "https://dediren.dev/schemas/package.schema.json",
  "type": "object",
  "additionalProperties": false,
  "required": ["package_schema_version", "models", "views"],
  "properties": {
    "package_schema_version": { "const": "package.schema.v1" },
    "presentation": { "$ref": "#/$defs/packagePresentation" },
    "models": {
      "type": "array",
      "minItems": 1,
      "items": { "$ref": "#/$defs/model" }
    },
    "views": {
      "type": "array",
      "minItems": 1,
      "items": { "$ref": "#/$defs/view" }
    },
    "exports": {
      "type": "array",
      "items": { "$ref": "#/$defs/export" }
    }
  },
  "$defs": {
    "model": {
      "type": "object",
      "additionalProperties": false,
      "required": ["id", "source"],
      "properties": {
        "id": { "type": "string", "minLength": 1, "pattern": "^[A-Za-z0-9][A-Za-z0-9._-]*$" },
        "source": { "type": "string", "minLength": 1 }
      }
    },
    "view": {
      "type": "object",
      "additionalProperties": false,
      "required": ["id", "render_policy", "outputs"],
      "properties": {
        "id": { "type": "string", "minLength": 1, "pattern": "^[A-Za-z0-9][A-Za-z0-9._-]*$" },
        "model": { "type": "string", "minLength": 1 },
        "render_policy": { "type": "string", "minLength": 1 },
        "presentation": { "$ref": "#/$defs/presentation" },
        "outputs": { "$ref": "#/$defs/outputs" }
      }
    },
    "presentation": {
      "type": "object",
      "additionalProperties": false,
      "properties": {
        "title": { "type": "string", "minLength": 1 },
        "question": { "type": "string", "minLength": 1 },
        "diagram_kind": { "type": "string", "minLength": 1 }
      }
    },
    "packagePresentation": {
      "type": "object",
      "additionalProperties": false,
      "properties": {
        "lang": {
          "type": "string",
          "pattern": "^[A-Za-z]{2,3}(-[A-Za-z0-9]{2,8})*$",
          "maxLength": 35
        },
        "dir": { "enum": ["ltr", "rtl"] }
      }
    },
    "outputs": {
      "type": "object",
      "additionalProperties": false,
      "required": ["diagram"],
      "properties": {
        "diagram": { "type": "string", "minLength": 1 },
        "render_metadata": { "type": "string", "minLength": 1 },
        "layout": { "type": "string", "minLength": 1 }
      }
    },
    "export": {
      "type": "object",
      "additionalProperties": false,
      "required": ["id", "lane", "policy", "output"],
      "oneOf": [{ "required": ["view"] }, { "required": ["model"] }],
      "properties": {
        "id": { "type": "string", "minLength": 1, "pattern": "^[A-Za-z0-9][A-Za-z0-9._-]*$" },
        "view": { "type": "string", "minLength": 1 },
        "model": { "type": "string", "minLength": 1 },
        "lane": { "enum": ["archimate-oef", "uml-xmi"] },
        "policy": { "type": "string", "minLength": 1 },
        "output": { "type": "string", "minLength": 1 }
      }
    }
  }
}
